Sentence,keyword
막학기에 계절학기로 재수강 가능?,
혹시.. 오수강도 가능..?ㅋㅋ,
재수강 제약 조건이 어떻게 돼?,
과목 이름도 다르고 코드도 다른데 대체과목이라고 적혀져 있으면 재수강이야?,
영강을 한국어 강의로 재수강하면 영강 쿼터 하나 줄어들어?,
기초C언어랑 듣고 고응씨 들으면 재수강이야?,
재수강 하면 최대 몇학점 받을 수 있어??,
계절로 재수강 해도 재수강 8회 제한에서 하나 깎여?,
몇학점부터 재수강 가능해?,
삼수강 최대 학점 몇점이야?,
국강을 영강으로 재수강을 할 수 있어? ,
재수강 한 학기에 여러 개 해도 돼?,
학기 중에 재수강 몇개까지 가능해?,
8번 채우면 재수강 못하나?,
D+ 재수강해서 A- 가능할까…? ,
재수강 최대 학점,
같은 과목 재수강 여러번 할 수 있을까,
한 학기에 재수강 여러개 할 수 있나,
막학기에도 재수강할 수 있어?,
재수강을 몇번 할 수 있냐,
재수강 최대 학점이 몇이야? ,
재수강 8번 했는데 이제 더 못해?,
F 재수강으로 복구할 수 있지? ㅜㅠㅠ,
F 받으면 재수강 해야하나?,
재수강하면 불이익 있을까? ,
재수강 하면 얼마 받을 수 있냐,
재수강 하면 성적 떨어질 수 있어?,
재수강할 때 다른 교수님으로 들어도 돼?,
재수강 하면 A+ 받을 수 있나?,
B+인데 재수강이 가능해? ,
학교 다니면서 재수강 총 몇 번 가능해? ,
재수강 하면 어떻게 뜨지?,
재수강 하면 얼마까지 받을 수 있어,
재수강 이름만 같으면 되나?,
재수강 최대 가능 횟수,
B받은 수업 재수강 가능?,
성성 한 번이라도 빠지면 재수강 해야돼?,
재수강 계절학기에 가능? ,
재수강 8번 넘게 하는 법 있어? ,
한국어 강의 들었는데 영어 강의로 재수강 돼? ,
재수강을 또 재수강할 수 있어?,
A-면 재수강 안되지? ,
삼수강하면 최대 학점 몇이야? ,
재수강 횟수제한?,
한 학기에 재수강 몇 개 할 수 있어?,
재수강 성적증명서에 기록 남아? ,
재수강 하면 학점 뭐로 바껴?,
재수강 하면 이전 기록은 어떻게 되지,
계절학기에 재수강하면 재수강 최대 횟수 늘어나?,
재수강 과목코드 같으면 다 되는거지?,
재수강 몇 개 까지 할 수 있냐,
재수강 하면 중간도 A-가 최대야?,
재수강 몇 번?,
울학교 재수강 제한 있음?,
재수강 관련 학칙 알려줘,
시험 조졌음…,
젠장… C+ 떴다,
시험을 망했습니다. 어떻게 해야할까요?,
걍 재수강 할까?,
교수님 다시 한번 뵈어요…,
B- 받았는데 재수강 할까요 말까요,
미워도다시한번,
시험 조졌다,
