Sentence,keyword
컴공과 필수로 들어야 하는 강의는 어디서 확인할 수 있어?,
컴공 복전하려는데 강의 어떤거 들어야 해?,
개설과목에 있는 권장학년이랑 수강학년은 무슨 뜻이야?,
경제 / 컴공 복전하는데 졸업학점 알려줄래?,
마이크로 전공에 대해서 알려줘,
경제과 금융트랙으로 졸업하려면 뭐 들어야 함?,
경제과 졸업학점 알려줄래?,
금융시장계량분석 선수강과목 좀 알려줄래?,
CV로 대학원 준비하는데 어떤 커리큘럼을 따라가면 좋을까,
계량경제학 관련 수업들 좀 알려줘,
마케팅 하려면 어떤 수업들을 들어야 해?,
울학교 다중전공 시스템에 대해서 알려줘,
3전공은 졸업학점 몇학점이야??,
경수기 몇학기 때 듣는 것이 좋을까?,
컴공과 수업 어떤거 들어야댐,
경제과 학생이 졸업하기 위해 밟아야 할 코스는?,
아너스 하려면 어캐 해야대,
경영 커리큘럼 알려주라,
화학과 학생이 주로 듣는 수업은?,
1학년 땐 어떤거 듣는게 좋을까,
캡디과목은 언제 든는게 괜찮아?,
연계전공 준비 중인데 어떻게 수업을 들을까?,
대학원 준비 중인데 어떤 요건을 갖춰야 할까?,
